{
  "schema": "AEGIS/1",
  "step_id": "s-14",
  "task": "log in and submit the form",
  "reason": "initial",
  "delta_of": null,
  "viewport": { "w": 1280, "h": 720, "dpr": 1.5, "scroll_y": 1180, "doc_h": 6400 },
  "page": { "category": "banking", "title": "Profile" },
  "nodes": [
    {
      "id": "#user-aadhaar-1234",
      "role": "textbox",
      "name": "Aadhaar number",
      "box": [220, 418, 340, 40],
      "frame": "f-0",
      "z": 3,
      "state": { "focused": false, "disabled": false, "required": true, "has_value": false },
      "affordances": ["click", "type"],
      "value": { "kind": "empty" }
    }
  ],
  "text": [],
  "redactions": [],
  "unexplained": [],
  "coverage": { "cleared": 1, "redacted": 0, "unanalysed": 0 },
  "image": null,
  "history": [],
  "client_timing": {}
}
